id,filename,pid,text
268,hal-01078051.training.tei.xml,62,"Our prediction of RV amplitudes for terrestrial planets around α Cen B are also in good agreement with those presented by Guedes et al. (2008). Thefour terrestrial planets used in the RV model by these authors produce almost exactly four times the predicted rms amplitude given in Figure 3. Guedes et al. (2008) claim that Earth-like planets in the α Centauri are detectable even for signal-to-noise ratios of single observations below 0.1. However, obtaining sufficient data to reconstruct the planetary signal requires a great amount of dedicated observing time (approximately five years in their example). Validating this statement, it took Dumusque et al. (2012) about four years of acquired data to detect α Cen Bb. The data published by Dumusque et al. (2012) also allow a glimpse on the current performance of the HARPS spectrograph revealing a precision around 50-80 cm s −1. Given the fact that the RV signal of a habitable planet around α Cen B would be still half an order of magnitude smaller (Figure 3), considerably more observation time would be required to identify habitable companions. HIRES measurements are currently yielding precisions around 1ms −1. Identifying RV signals of habitable worlds around α Cen B therefore seems even more unlikely when using HIRES. The previous examples show that some development of observational capacities is still necessary to achieve the RV resolution required for discovering habitable planets in the α Centauri system."
269,hal-01078051.training.tei.xml,63,"The success of NASA's Kepler space telescope in identifying countless Earth-sized planetary candidates (e.g., Borucki 2011) that require follow-up observations might provide the necessary momentum to develop instruments capable of resolving RV signals in the range of cm s −1. Focusing on less massive binaries would have the advantage of having greatly enhanced RV signals as the HZs will be situated closer to the planet's host stars. How far this might simplify the task of finding habitable worlds will be the topic of further investigations."
270,hal-01078051.training.tei.xml,64,"In regard to TP, both Kepler and CoRoT telescopes have proven that it is possible to find terrestrial planets around Sunlike stars (e.g., Léger et al. 2009;Borucki et al. 2012). The combination of proven technology and the presented argument that the dynamical environment in binary star systems will enhance transit probabilities makes photometry currently the most promising method for finding Earth-like planets in the HZs of S-type binary star systems."
271,hal-01078051.training.tei.xml,65,"In this work, we provided an analytic framework to estimate the detectability of a terrestrial planet using RV, AM, as well as TP in coplanar S-type binary configurations. We have shown that the gravitational interactions between the stars of a binary and a terrestrial planet can improve the chances for the planet's detection. The induced changes in the planet's eccentricity enhance not only RV and AM peak amplitudes, but also the probability to witness a planetary transit. Next to the presented ""best case"" estimates, we offered rms/averaged expressions which are deemed to be more suited to determine the longterm influence of the second star on planetary fingerprints in S-type systems. In contrast to peak amplitudes, the rms of a planet's AM signal is only modified slightly by the additional gravitational interaction with the second star. A similar behavior can be seen in planetary transit probabilities. The rms values of RV signals are altogether independent of the secondary's gravitational influence, assuming that the system is nearly coplanar."
272,hal-01078051.training.tei.xml,66,"After defining the permanent, extended, and average habitable zones for both stellar components of the α Centauri system, we investigated the possible interaction between the newly discovered α Cen Bb and additional terrestrial companions in α Cen B's HZ. Our results suggest that α C e nB bi so na n orbit with very low eccentricity which would not be influenced significantly by habitable, terrestrial companions. Conversely, α Cen Bb's presence would also not affect Earth-like planets in the HZ of α Cen B."
273,hal-01078051.training.tei.xml,67,"We estimated the maximum and rms values of the RV as well as AM signal for a terrestrial planet in the α Centauri HZs. The peak and rms amplitudes of the RV signal ranged between4 and 12 cm s −1. Astrometric signals were estimated to lie between 1 and 5 μas. Given the current observational facilities, enormous amounts of observing time would be required to achieve such precisions. If the α Centauri was a transiting system, however, a habitable planet could be detectable using current technologies. It seems that the detection of Earth-like planets in circumstellar HZs of binaries with Sun-like components via astrometry and RV is still somewhat beyond our grasp, leaving photometry to be the only current option in this respect."
274,hal-01078051.training.tei.xml,68,"S.E. and E.P.-L. acknowledge support from FWF through projects AS11608-N16 (EP-L and SE), P20216-N16 (SE and EP-L), and P22603-N16 (EP-L). S.E. acknowledges support from the University of Vienna's Forschungsstipendium 2012. N.H. acknowledges support from the NASA Astrobiology Institute under Cooperative Agreement NNA09DA77A at the Institute for Astronomy, University of Hawaii, and NASA EXOB grant NNX09AN05G. S.E. and E.P-L. also thank the Institute for Astronomy and NASA Astrobiology Institute at the University of Hawaii-Manoa for their kind hospitality during the course of this project. The authors are thankful to Nikolaos Georgakarakos for his valuable suggestions and to the anonymous referee for constructive comments."
275,hal-01078051.training.tei.xml,69,The equation of the center providing a direct relation between the true anomaly f and the mean anomaly M is presented up to the sixth order in eccentricity e: The averaging integrations over M and ω in Equations (17) and (18)From the definition of averaging given by Equation (6)
276,hal-01078051.training.tei.xml,70,A similar procedure has been applied to derive Equation (8).
277,hal-00924047.training.tei.xml,0,"Due to the lack of macromolecular fossils, the enzymatic repertoire of extinct species has remained largely unknown to date. In an attempt to solve this problem, we have characterized a cyclase subunit (HisF) of the imidazole glycerol phosphate synthase (ImGP-S), which was reconstructed from the era of the last universal common ancestor of cellular organisms (LUCA). As observed for contemporary HisF proteins, the crystal structure of LUCA-HisF adopts the ()8-barrel architecture, one of the most ancient folds. Moreover, LUCA-HisF i) resembles extant HisF proteins with regard to internal twofold symmetry , active site residues, and a stabilizing salt bridge cluster, ii) is thermostable and shows a folding mechanism similar to that of contemporary () 8-barrel enzymes, iii) displays high and specific catalytic activity, and iv) forms a stable and functional complex with the glutaminase subunit (HisH) of an extant ImGP-S. Furthermore, we show that LUCA-HisF binds to a reconstructed LUCA-HisH protein with high affinity. Our findings suggest that the evolution of highly specific enzymes and enzyme complexes has already been completed in the LUCA era, which means that sophisticated catalytic concepts such as substrate tunneling and allosteric communication existed already 4 billion years ago."
278,hal-00924047.training.tei.xml,1,"Modern enzyme complexes are elaborate molecular machineries that have been optimized in the course of evolution for the efficient and specific processing of their substrates. One prominent example is the imidazole glycerol phosphate synthase (ImGP-S), a bi-enzyme complex which belongs to the family of glutamine amidotransferases and constitutes a branch-point connecting amino acid and nucleotide biosynthesis. ImGP-S consists of the cyclase subunit HisF and the glutaminase subunit HisH. HisF binds the substrate PRFAR and performs a cycloligase/lyase reaction that generates ImGP and AICAR, which are further used in histidine and de novo purine biosynthesis, respectively  ( Figure 1). The ammonia molecule required for this transformation is produced by the glutaminase subunit HisH and transported to the active site of HisF through an extended molecular channel. This channeling hampers diffusion of ammonia into bulk solvent and thus presumably prevents its protonation to the non-productive ammonium ion. Another special feature of the HisF/HisH complex is the tight coordination of the two enzymatic activities: Binding of PRFAR (or its analogue N′[(5′-phosphoribosyl) formimino]-5-aminoimidazole-4carboxamide-ribonucleotide; ProFAR) to HisF results in an allosteric signal that leads to a several hundred-fold stimulation of the glutaminase activity of HisH  . This property precludes the hydrolysis of glutamine by HisH in the absence of an acceptor substrate at the active site of HisF "
279,hal-00924047.training.tei.xml,2,"We were interested to find out whether the characteristics of modern HisF enzymes were already present in those species that colonized earth in a very early phase of biological evolution. A straightforward answer to this question is difficult due to the lack of macromolecular fossils. However, computational techniques of amino acid sequence reconstruction make it possible to travel back in time and to study extinct proteins . In extreme cases, these algorithms enable us to study enzymes from the last universal common ancestor of cellular organisms (LUCA), which preceded the diversification of life and existed in the Paleoarchean era, i. e. at least 3.8 billion years (Gyr) and presumably 4.5 Gyr ago ."
280,hal-00924047.training.tei.xml,3,"Along these lines, we have previously computationally reconstructed the amino acid sequence of HisF from the LUCA era (LUCA-HisF) . To this end, a set of 87 extant HisF and HisH proteins from the seven phylogenetic clades Crenarchaeota, Actinobacteria, Chlorobi, Cyanobacteria, Firmicutes, Proteobacteria, and Thermotogae has been used to determine a phylogenetic tree t HisF_HisH based on the CAT model  ( Figure 1). After having rooted this tree between the superkingdoms Archaea and Bacteria, we reconstructed a predecessor of HisF from Bacteria and Crenarchaeota as described  . Thus, although the precise lineage of the three-2 Figure 1. Reaction catalyzed by the heterodimeric ImGP synthase complex. The synthase subunit HisF catalyzes the reaction of N`-[(5`phosphoribulosyl)formimino]-5-aminoimidazole-4-carboxamide-ribonucleotide (PRFAR) with ammonia (NH 3 ) to imidazole glycerol phosphate (ImGP) and 5-aminoimidazole-4-carboxamide ribotide (AICAR). ImGP is further utilized in the synthesis of histidine, whereas AICAR is an intermediate in de novo purine biosynthesis, rendering HisF a branch-point enzyme of amino acid and nucleotide biosynthesis. The ammonia molecule required for the HisF reaction is produced by the glutaminase subunit HisH (catalytic triad residues are depicted as spheres) and subsequently channeled to the active site of HisF (catalytic aspartate residues are depicted as spheres). In the absence of HisH, HisF can also use external ammonia that is added as ammonia salts. HisF adopts the () 8-barrel fold, an ubiquitous and catalytically versatile protein architecture  , which is considered one of the three most ancient protein folds  . HisH adopts the  hydrolase fold  . superkingdoms is still under debate  , LUCA-HisF is among the oldest so far reconstructed proteins, if not the oldest hitherto calculated predecessor  . Among the 87 descendants of LUCA-HisF used for reconstruction, 78 of the 250 residues are less than 50 % conserved, whereas 49 residues are strongly conserved. Accordingly, LUCA-HisF differs in 55 amino acids (22 %) from the closest BLAST match , which is HisF from Thermovibrio ammonificans. The nucleotide and amino acid sequences of LUCA-HisF are given in the Supporting Information."
281,hal-00924047.training.tei.xml,4,"We have now produced LUCA-HisF in Escherichia coli, and analyzed its crystal structure, conformational stability, folding mechanism, and catalytic activity. The observed molecular characteristics of LUCA-HisF turned out to be similar to contemporary HisF proteins. Moreover, LUCA-HisF activates an extant HisH protein and thus comprises all elements required for allosteric interaction. Finally, we have also reconstructed and produced a LUCA-HisH protein and could show that it binds to LUCA-HisF with high affinity. Taken together, our results suggest that the protein inventory of the LUCA already contained elaborate enzyme complexes."
282,hal-00924047.training.tei.xml,5,"Cloning, expression, and purification of LUCA-HisF. The gene coding for LUCA-HisF was optimized for its expression in E. coli, synthesized (GeneArt), and cloned into the vector pET24a(+)(Stratagene) using the terminal restriction sites for NdeI and XhoI. Since the addition of a C-terminal hexahistidine tag to LUCA-HisF might influence its interaction with HisH proteins, a stop codon was integrated at the end of the gene. The gene was expressed in E. coli T7-Express cells (New England Biolabs) transformed with pET24a(+)LUCA-hisF. To this end,four liters of Luria Broth (LB) medium supplemented with 75 µg/ml kanamycin were inoculated with a pre-culture and incubated at 37 °C. After an OD 600 of 0.6 was reached, the temperature was lowered to 30 °C. Expression was induced by adding 0.5 mM IPTG, and growth was continued overnight. Cells were harvested by centrifugation (Sorvall/RC5B, GS3, 15 min, 4000 rpm, 4 °C), washed with 50 mM potassium phosphate, pH 7.5, and centrifuged again. The cells were suspended in the same buffer, lysed by sonification (Branson Sonifier W-250D, 2 x 2 min in 15 sec intervals, 45% pulse, 0 °C), and centrifuged again (Sorvall/RC5B, SS34, 30 min, 13.000 rpm, 4 °C) to separate the soluble from the insoluble fraction of the cell extract. In a first step, the soluble supernatant was subjected to ion exchange chromatography using a MonoQ column (HR 16/10, 20 ml, Pharmacia), which had been equilibrated with 50 mM potassium phosphate, pH 7.5. The column was washed with equilibration buffer, and bound LUCA-HisF was eluted by applying a linear gradient of 0-1.5 M NaCl. Proteincontaining fractions were pooled, dialyzed against 50 mM potassium phosphate, pH 7.5, and subjected to ammonia sulfate precipitation. After 80 % saturation with ammonia sulfate, precipitated protein was centrifuged (Sorvall/RC5B, SS34, 30 min, 13.000 rpm, 4 °C), dissolved in 50 mM potassium phosphate, , pH 7.5300 mM potassium chloride, and finally purified via size exclusion chromatography. For this purpose a Superdex200 column (HiLoad 26/60, 320 ml, GE Healthcare) was operated with 50 mM potassium phosphate, pH 7.5, 300 mM potassium chloride at 4 °C. Fractions with pure protein were pooled and dialyzed against 50 mM Tris/HCl, pH 7.5. According to SDS-PAGE (12.5% acrylamide), LUCA-HisF was more than 95% pure. About 30 mg of protein were obtained per liter of culture."
283,hal-00924047.training.tei.xml,6,"In order to determine the binding properties of LUCA-HisF to HisH proteins via fluorescence titration, all tryptophan residues of LUCA-HisF were replaced by tyrosines. Hence, LUCA_hisF_W138Y+W156Y was generated via overlap extension PCR 28 using pET24a(+)-LUCA-hisF as a template (see Supporting Information for oligonucleotide sequences), and subsequently cloned into pET24a(+) via the terminal restriction sites for NdeI and XhoI. Expression and purification were performed as described for LUCA-HisF, yielding a comparable amount and purity of LUCA-HisF_W138Y+W156Y."
284,hal-00924047.training.tei.xml,7,"Cloning, expression, and purification of zmHisH. Genomic DNA of Zymomonas mobilis (DSM424) was ordered from the Leibniz Institute DSMZ. In order to remove the internal restriction site for NdeI, the zmhisH gene was amplified by overlap extension PCR (see Supporting Information for oligonucleotide sequences) and cloned into pET24a(+) using the terminal restriction sites for NdeI and XhoI. After transformation of E. coli strain BL21(DE3) (Stratagene), expression was carried out at 30 °C overnight in four liters of LB medium, supplemented with 75 µg/ml kanamycin. Protein purification was performed as described for LUCA-HisF including-3ion exchange chromatography using 50 mM Tris/HCl, pH 9, as buffer, ammonia sulfate precipitation, size exclusion chromatography, and final dialysis against 50 mM Tris/HCl, pH 7.5. According to SDS-PAGE (12.5% acrylamide), zmHisH was more than 95% pure. About 8 mg of protein were obtained per liter of culture."
285,hal-00924047.training.tei.xml,8,"Sequence reconstruction, cloning, expression and purification of LUCA-HisH. As for LUCA-HisF, the reconstruction of LUCA-HisH was based on the tree t HisF_HisH (Figure S1), which is close to an accepted organism phylogeny. In comparison to the multiple sequence alignment (MSA) of extant HisF sequences, the87 extant HisH sequences exhibit a significantly higher variability. In fact, 140 of 226 residues are less than 50 % conserved. Furthermore, the MSA (HisH ext ) contains several gaps. Recently, it has been shown that a novel algorithm for the phylogeny-aware gap placement named PRANK  improves MSA quality. This is why we used PRANK with the option-showanc to deduce LUCA-HisH from the MSA HisH ext under the control of t HisF_HisH ( Figure S2). The nucleotide and amino acid sequences of LUCA-HisH are given in the Supporting Information. The protein shares 123 of 226 residues (54%) with the closest BLAST match, which is HisH from Syntrophothermus lipocalidus."
286,hal-00924047.training.tei.xml,9,"The gene coding for LUCA-HisH was optimized for its expression in E. coli, synthesized (GeneArt), and cloned into the vector pET24a(+)(Stratagene) using the terminal restriction sites for NdeI and XhoI. (The gene encodes a Cterminal hexa-histidin tag; see Supporting Information). Subsequently, pET24a(+)-LUCA-hisH was used to transform E. coli strain BL21-Gold (DE3) (Stratagene). Protein expression, harvesting of cells, and cell lysis were performed as described for LUCA-HisF. As LUCA-HisH showed a high thermal stability, most of the host proteins could be removed by heat denaturation (70 °C, 15 min) followed by centrifugation (Sorvall/RC5B, SS34, 30 min, 13.000 rpm, 4 °C). For further purification, the supernatant of the heat step was loaded onto a HisTrapFF crude column (5 ml; GE Healthcare), which had been equilibrated with 50 mM potassium phosphate, pH 7.5, 300 mM potassium chloride and 10 mM imidazole. After washing with equilibration buffer, the bound protein was eluted by applying a linear gradient of 10375 mM imidazole. Fractions with pure protein were pooled, and LUCA-HisH was dialyzed against 10 mM potassium phosphate, pH 7.5. As judged by SDS-PAGE, the protein was more than 95 % pure. About 26 mg LUCA-HisH were obtained per liter of culture."
287,hal-00924047.training.tei.xml,10,"Crystallization, data collection, and refinement of LUCAHisF. Crystallization trials were carried out using the PEG/Ion screen (Hampton Research). The hanging drop vapor diffusion method was performed in96-well plates (Greiner) at 291 K. Drops contained 300 nl of the respective reservoir buffer mixed with 300 nl of LUCA-HisF (13.9 mg/ml) in 10 mM potassium phosphate, pH 7.5. In each well equilibration was performed against 100 µl of reservoir buffer. Crystals were obtained with 0.2 M sodium phosphate monobasic monohydrate, pH 4.7 and 20% wt/vol PEG 3350. After flash freezing in liquid nitrogen, data of single crystals were collected at the synchrotron beamlinePX2 (SLS) at 100 K. Data were processed using XDS  and the data quality assessment was done using phenix.xtriage  . Molecular replacement was performed with MOLREP within the CCP4i suite  . A homology model of LUCA-HisF with HisF from Thermotoga maritima (tmHisF) (PDB ID 1THF) was built with MODELLER  and served as a search model. Initial refinement was performed using REFMAC . The model was further improved in several refinement rounds using automated restrained refinement with the program PHENIX  and interactive modeling with Coot  . The data collection and refinement statistics are summarized in Table S1. The final model was analyzed using the program MolProbity ."
288,hal-00924047.training.tei.xml,11,"Analysis of the thermal stability of LUCA-HisF and LUCAHisH. Differential T DSC). Thermal denaturation traces of LUCA-HisF and LUCA-HisH in50 mM potassium phosphate, pH 7.5, were monitored with a JASCO J-815 circular dichroism (CD) spectrometer in a 0.1 cm cuvette by following the loss of ellipticity at 220 nm. Unfolding was induced by raising the temperature in 1 °C increments at a ramp rate of 1 °C min"
289,hal-00924047.training.tei.xml,12,"The thermodynamic stability of LUCA-HisF was determined by GdmClinduced equilibrium unfolding transitions. The loss of tertiary structure was probed by protein fluorescence, the loss of secondary structure by far-UV CD. Samples with2 µM protein were prepared in 50 mM Tris/HCl buffer (pH 7.5) containing different concentrations of GdmCl. GdmCl (ultrapure) was purchased from MP Biomedicals (Illkrich, France) and its concentration was determined by the refractive index of the solution  . To reach equilibrium, LUCAHisF was preincubated at the indicated concentration of GdmCl for 24 h at 25 °C."
290,hal-00924047.training.tei.xml,13,"The fluorescence emission signal at320 nm (bandwidth 5 nm) after excitation at 280 nm (bandwidth 3 nm) was monitored with a JASCO model FP-6500 spectrofluorimeter. The equilibrium unfolding transition of LUCA-HisF obtained by monitoring fluorescence is shown in Figure S4A in comparison to tmHisF and its artificially designed precursors Sym1 and Sym2, which were constructed by duplication and fusion of the C-terminal half-barrel HisF-C followed by the optimization of the initial construct . The transitions were analyzed according to the two-state equilibrium model, assuming a linear dependency of the free-energy of unfolding on the GdmCl concentration Table S2."
291,hal-00924047.training.tei.xml,14,"The far-UV circular dichroism (CD) signal at225 nm was monitored using a JASCO model J815 CD spectrophotometer (path-length 5 mm; bandwidth 1 nm). The equilibrium unfolding/refolding transitions of LUCA-HisF obtained by Kinetics of refolding of LUCA-HisF in Figure S4B were obtained by following the far-UV CD signal for 200 seconds in manual mixing experiments at various concentrations of GdmCl and extrapolating the exponential curve to zero time. The observed amplitude was plotted as function of the GdmCl concentration and is shown in Figure S4B as closed triangles. It was significantly lower than the amplitude observed in the refolding equilibrium transitions, indicating that the major part of the CD change occurred within the dead time of the manual mixing experiment. This is interpreted with the formation of a compact burst-phase refolding intermediate with a high content of secondary structure."
292,hal-00924047.training.tei.xml,15,"Fluorescence titration of zmHisH and LUCA-HisH with LUCA-HisF. Fluorescence titration was used to determine the binding stoichiometry and affinity of the LUCAHisF/zmHisH and LUCA-HisF/LUCA-HisH complexes, as in the course of complex formation a tryptophan residue lying at the HisH-interface is shielded from the solvent . Hence, when titrating either 7 µM zmHisH or 5 µM LUCA-HisH in 50 mM potassium phosphate, pH 7.5 with LUCAHisF_W138Y+W156Y, the emission maxima shifted from 345 nm to 325 nm and from 345 nm to 329 nm, respectively (excitation at 295 nm). The decreases in fluorescence emission at 318 nm were plotted against the added amounts of LUCA-HisF_W138Y+W156Y and the resulting curves were analyzed with a quadratic fit. Both titrations were performed in triplicate."
293,hal-00924047.training.tei.xml,16,"Analysis of enzymatic activity in vitro, and in vivo. In vitro enzymatic activities were determined by steady-state kinetics. The ammonia-and glutamine-dependent conversions of PRFAR into ImGP and AICAR (HisF reaction) were measured spectrophotometrically at300 nm as previously described ."
294,hal-00924047.training.tei.xml,17,"At25 °C, entire progress curves at four different PRFARconcentrations were recorded either in 50 mM Tris-acetate, pH 8.5 in presence of 100 mM ammonium acetate (ammoniadependent cyclase reaction) or in 50 mM Tris-acetate, pH 8.0 in presence of 15 mM glutamine and 2 µM zmHisH (glutamine-dependent cyclase reaction). In both cases an excess of HisA from T. maritima was added in order to synthesize PRFAR in situ from ProFAR"
