id,filename,pid,text
850,inserm-00752141.training.tei.xml,18,"The age-related decline was more pronounced in running compared to cycling for both the Triple Iron ultratriathletes and the Deca Iron ultra-triathletes. Running involves stretch-shortening cycles with eccentric muscle actions, while cycling is a nonweight-bearing activity with predominant concentric muscle actions. With increasing age, the fast-twitch muscle fibres atrophy more than slow-twitch muscle fibres. Since the fast-twitch fibres seem to be more susceptible to damage than the slow-twitch fibres during stretch-shortening cycles, the greater reduction in running performance compared with cycling could, therefore, be related to muscle typology changes with increasing age . However, the changes in muscle fibre type distribution such as the percentage of type I muscle fibres with advancing age seem to be less pronounced in well-trained master athletes compared to untrained older adults ."
851,inserm-00752141.training.tei.xml,19,"A further aspect in these ultra-endurance races is the loss of substantial body mass such as skeletal muscle mass and fat mass. In ultra-endurance races, a loss in body mass has been described, contributing to a decrease in solid masses. An ultra-endurance performance leads to a decrease in both skeletal muscle and fat masses . In Ironman , Triple Iron ultratriathletes , and Deca Iron ultra-triathletes , a significant decrease in skeletal muscle mass has been described. It is, therefore, likely that the more pronounced age-related decline in running performance in the Deca Iron ultra-triathletes was rather due to the considerably longer nature of the race with the corresponding loss in skeletal muscle mass than the effect of age. The decrease in skeletal muscle mass is most probably due to the increased mechanical stress due to the eccentric nature of running. It has been demonstrated that longer distance running in an ultra-marathon induced more impact-stress on the skeletal muscle than a marathon ."
852,inserm-00752141.training.tei.xml,20,"The first limitation of this cross-sectional study is the problem arising from the data collection. Firstly, it is not sure at100% that there are no data errors (age, race time) when taking them from the race websites and the official rankings. Secondly, we cannot assure that the age-related performance decline is not at least partly due to non-participation of older athletes or simply to a selfchosen lower intensity of older athletes. In addition, race participants may represent selected sub-groups of the total population of ultra-triathletes, e.g. some potential participants may have been prevented from participating due to many reasons."
853,inserm-00752141.training.tei.xml,21,"It was not possible to collect other performance-related factors such as characteristics of training, anthropometry  and previous experience . Thus, these factors had to be ignored in this study. In addition, we have not included environmental conditions. It has been shown that an ultra-performance  progressively slows down when the ambient temperature increases ."
854,inserm-00752141.training.tei.xml,22,"This cross sectional study found that the magnitudes of age-related declines in ultra-triathlon performance for Triple Iron and Deca Iron triathlon are quite similar. For both Triple Iron and the Deca Iron ultra-triathletes, the fastest race times were achieved between25 and 44 years of age, although participants at the Triple Iron triathlon were on average younger compared to the Deca Iron triathlon. Further studies should investigate the motivation and training of ultra-triathletes to gain better insights in ultra-triathlon performance."
855,inserm-00752141.training.tei.xml,23,The data sets supporting the results of this article are available in http://www.triathlonlensahn.de and http:// www.multisport.com.mx.
856,inserm-00752141.training.tei.xml,24,"This study was approved by the Institutional Review Board of St. Gallen, Switzerland, with a waiver for the requirement of an informed consent given by the subjects since the study involved the analysis of publicly available data. Fortwo annual ultra-triathlons, one Triple Iron triathlon and one Deca Iron triathlon, the age of the athlete in the year of the race together with the swimming, cycling, running and total race times in the year of each race were analysed from 1992 to 2010. During this period, both the Triple Iron triathlons in Lensahn, Germany and the Deca Iron triathlons in Monterrey, Mexico were held regularly. The data set from this study was obtained from the race websites www.triathlonlensahn.de for the Triple Iron triathlon Germany in Lensahn, www.multisport.com.mx for the Deca Iron triathlon in Monterrey, Mexico and from the race directors involved."
857,inserm-00752141.training.tei.xml,25,"The Triple Iron ultra-triathlon in Germany took place in Lensahn, Schleswig-Holstein, Germany, and was comprised of11.6-km swimming, 540-km cycling and 126.6km running. The swimming was held in a 50-m heated outdoor pool at a temperature of approximately 25°C, and wetsuits were allowed. After passing through the transition area, the participants cycled 67 laps of 8 km each on a hilly course in the surroundings of the town. At the next transition, the athletes changed and ran 96 laps of a 1.31-km per lap flat run course in the town of Lensahn. The cycling course was nearly free of road traffic, and the run course was completely free of traffic and illuminated during the night. All the athletes had their own support crew to provide nutrition and changes of clothes or equipment. The athletes had to arrive at the finish line within 58 h of the race start. The Deca Iron ultra-triathlon took place in Monterrey, Mexico. The athletes completed a total distance of 38-km swimming, 1,800-km cycling and 422-km running. Swimming commenced in the 50-m outdoor pool in Monterrey in the 'Sociedad Cuauhtemoc & Famosa Park' , 3 km away from the cycle and run track in 'Parque Niños Héroes'.T h e pool was not heated and the water temperature was approximately 27°C. The laps of 100 m were counted by personal lap counters for each athlete. After completing the swimming, the athletes changed in the transition area, and due to the high traffic volume, were transferred by car to 'Parque Niños Héroes'. A period of 30 min was allowed for the transfer from pool to park, which was deducted from the final race time. The park was closed to traffic, completely illuminated and with a 1.915-km cycle/run track that is approximately 95% flat but included an inclination of approximately 5%. After the cycling, the athletes changed and went directly to the run course which was on the same track but in the opposite direction. Drafting in the cycle section was strictly prohibited and controlled by the race director. The laps on both the cycle and run courses were counted electronically using a microchip system. The athletes can be helped by their own support crew for nutrition and changes of equipment and clothes. During the whole race, accommodation is offered in the Sports Village inside the park, about 250 m away from the race site. The athletes and their support crews have a room with bed, toilet and shower. For nutrition, the organiser offered a variety of food in a restaurant, at the race site, that was open 24 h a day."
858,inserm-00752141.training.tei.xml,26,"In each race year, the age of the winner and the mean age of the male finishers were analysed at both the Triple Iron ultra-triathlons and the Deca Iron ultra-triathlons from1992 to 2010."
859,inserm-00752141.training.tei.xml,27,"In order to analyse the age-related changes in swimming, cycling, running and the total race performances, we pooled the data from1992 to 2010 for both distances.  Performance times were converted to minutes. For the Triple and Deca Iron ultra-triathlons, the fastest ten swimming, cycling and running times, together with the total event times for each age group were determined for the 19-years period."
860,inserm-00752141.training.tei.xml,28,"Data are reported as means ± standard deviations (±SD) in the text and the figures. Linear regressions were used for estimating the changes in the age of winners and the mean age of finishers per year. Pearson's correlation coefficients were used to assess the association between the age and the years. One-way ANOVA was used to compare the ages of the Triple and the Deca Iron ultratriathlon winners and the mean ages of the finishers. One-way ANOVA was used to compare the swimming, cycling, running and total race times between the different age groups for both distances. Tukey's post hoc analyses were used to test differences within the ANOVA when appropriate. Statistical significance was accepted at p <0.05 (Statsoft, Version 6.1, Statistica, Tulsa, OK, USA)."
861,inserm-00752141.training.tei.xml,29,performed the statistical analyses and helped draft the manuscript. All authors read and approved the final manuscript.
862,inserm-00752141.training.tei.xml,30,The authors would like to thank the race directors for providing the race results and Mary Miller for her help in translation.
863,inserm-00752141.training.tei.xml,31,The authors have no conflict of interest.
864,1408.2792.training.tei.xml,0,"Although the nucleus of comet C/2013 A1 (Siding Spring) will safely pass Mars inOctober 2014, the dust in the coma and tail will more closely approach the planet. Using a dynamical model of comet dust, we estimate the impact fluence. Based on our nominal model no impacts are expected at Mars. Relaxing our nominal model's parameters, the fluence is no greater than ∼ 10 −7 grains m −2 for grain radii larger than 10 µm. Mars orbiting spacecraft are unlikely to be impacted by large dust grains, but Mars may receive as many as ∼ 10 7 grains, or ∼ 100 kg of total dust. We also estimate the flux of impacting gas molecules commonly observed in comet comae."
865,1408.2792.training.tei.xml,1,"Comet C/2013 A1 (Siding Spring) will pass Mars with, and a relative speed of 55.96 km s −1 on 2014 Oct 19 at 18:29±:03 UTC (3-σ uncertainties; Farnocchia et al. 2014). The nucleus will miss the planet, its moons, and orbiting spacecraft. However, given the right combination of ejection velocity, ejection time, and response to radiation pressure, dust grains from the comet can reach the planet. Farnocchia et al. (2014) predict that Mars will miss the comet's orbit by 2.7 × 10 4 km at 20:10 UTC. This second close approach potentially reduces the energy required to place dust grains on impacting orbits. We present models of the dust and gas based on the summary of the comet's activity by Farnham et al. (in preparation) and estimate the impact hazard for Mars and its satellites as well as the comet gas flux at Mars."
866,1408.2792.training.tei.xml,2,"To assess the impact hazard, we generatedtwo simulations of 10 9 particles each, picked from broad parameter ranges. These raw simulations act as guides to determine which combinations of size, ejection speed, and ejection time may result in impacts. Next, we define more limited parameter sets that are carefully chosen to match known parameters of the comet. We select and weight particles from the raw simulations that match those sets, and use them to estimate the fluence at Mars. Below we describe our dynamical model, the raw simulations, and four parameter sets used to estimate the impact hazard."
867,1408.2792.training.tei.xml,3,"The circumstances of the encounter are simulated with the dynamical model of Kelley (2006). For this study we msk@astro.umd.edu use the JPL ephemeris solution #46 ( Farnocchia et al. 2014). In order to reduce the required computational time, we modified the model to use thetwo-body (Keplerian) propagation functions from NASA's Navigation and Ancillary Information Facility SPICE toolkit. Dust grains are parameterized by β, the ratio of the force from solar radiation pressure to the force from solar gravity: β = 0.57Q pr /ρa, where Q pr is the radiation pressure efficiency, ρ is the grain density in units of g cm −3 , and a is the grain radius in units of µm ( Burns et al. 1979). In the Keplerian solution, the gravitational force from the Sun is reduced by the factor (1 − β)."
868,1408.2792.training.tei.xml,4,"The magnitude of the error introduced by neglecting planetary perturbations can be estimated by comparingzero-ejection velocity syndynes (lines of constant β with variable ejection times; Finson & Probstein 1968) generated using the Keplerian solution to those generated using the original code. The distances between the syndynes define the error. For grains ejected up to 4 years before the closest approach, the error is at most 300 km for dust found within 10 6 km from the nucleus. We also considered whether the gravitational pull of Mars is significant. Ignoring the atmosphere, particles grazing the surface are displaced < 100 km at closest approach, and the cross-section enhancement factor from gravitational focusing by Mars is 1.008 (Jones & Poole 2007). The Keplerian solution is sufficient for our purposes."
869,1408.2792.training.tei.xml,5,"Simulation 1 contains10 9 particles selected from the following parameters, based on observations of the comet with a generous conservative margin: ages range uniformly from 0 to 4 yr (out to r h = 13 AU); expansion speeds range uniformly from 0 to v ref (a/1 mm) −0.5 (r h /5 AU) −1 , where v ref = 1.9 m s −1 is the expansion speed of 1 mm grains ejected at 5 AU from the Sun; ejection velocities are radial and isotropically distributed around the nucleus; and, radii are selected from a distribution uniform in log-space (dn/d log a ∝ 1) ranging from 10 to 10 4 µm. The logarithmic distribution ensures our final results will have a statistically uniform representation of each size decade. For the conversion from radius to β we assume a grain density of 1 g cm −3 , and Q pr = 1. J.Y. Li et al. (in preparation) imaged Siding Spring at 4.6, 3.8, and 3.3 AU from the Sun with the Hubble Space Telescope WFC3 instrument. The high spatial resolution of the images (40 mas per pixel, corresponding to ≥ 100 km per pixel) resolve the inner coma, and allow investigations of the dust grain expansion velocities. Farnham et al. (in preparation) analyzed those images and found that the dust that comprises the bulk of the coma and tail has speeds best matched by v ref (a/1 mm) −0.6 (r h /5 AU) −1.5 , for v ref = 0.42 m s −1. Grains with these speeds are a subset of simulation 1."
870,1408.2792.training.tei.xml,6,"For an alternative scenario we consider the analysis of the Hubble images by Li et al.. Using the distance from the nucleus to the outer edge of the coma in the sunward direction, they find that the heliocentric distance dependence of the resulting speeds follow v ej ≈ 800 r −2 h m s −1 for r h =3.3 − 4.6 AU, assuming β = 1 grains (v ref ≈ 0.76 m s −1 ). Speeds based on this relationship for r h < 2.0 AU exceed those in simulation 1. Therefore, we ran a second 10 9 particle simulation (simulation 2) with speeds picked uniformly from 0 to v ref (a/1 mm) −0.5 (r h /5 AU) −2 for v ref = 1.9 m s −1. However, we note that these speeds, derived from some of the fastest moving grains in the coma, are much higher than the Farnham et al. results, derived from the coma and tail morphologies. Analyses based on the Li et al. speeds will serve as upper-limit cases for fast moving grains not accounted for in the Farnham et al. approach. In order to transform the simulations into an impact hazard at Mars, we first rotate the position vectors from the ecliptic J2000 coordinate frame into a reference frame defined at closest approach: the x-axis is given by the comet-Mars position vector, the y-axis by the cometMars velocity vector, and the z-axis by the right-hand rule. Simulations 1 and 2 projected into this reference frame is shown in Fig. 1. The relative timing of grains arriving at Mars is based on their y-axis position; 10 5 km corresponds to a time difference of 29.8 min. We then weight each particle to remove the bias introduced by our raw simulation's grain size distribution, and to provide a real estimate of the grain's frequency of occurrence in the comet coma. The particle weights are based on the parameter sets in Table 1."
871,1408.2792.training.tei.xml,7,"Set A is the nominal case, directly based on the results of Farnham et al. (in preparation). Sets B, C, and D are variations chosen to provide upper-limit estimates on the impacting dust. First, consider that the tail analysis of Farnham et al. best describes the smallest grains (a10 µm) and closest heliocentric distances (3 AU ≤ r h 5 AU), and is extrapolated to larger a and r h. Therefore, as an alternative scenario, we have defined set B using a radius and heliocentric distance dependence in closer agreement to theoretical predictions:"
872,1408.2792.training.tei.xml,8,"Set C has the same parameters as set B, but the dust is shifted closer to Mars according to the ephemeris's 3σ error ellipse ( Farnocchia et al. 2014). In our closest approach reference frame described above, the dust is displaced by ∆X =4471 km, ∆Z = −1722 km."
873,1408.2792.training.tei.xml,9,"Set D is based on our nominal case, but uses simulation 2 and the ejection speeds found by Li et al. (in preparation). As described above, these speeds are representative of the fastest moving grains, and not the whole coma."
874,1408.2792.training.tei.xml,10,"The future activity of comet Siding Spring is challenging to predict, but must be based on our present set of observations. We make two predictions of the gas production rate at Mars, based on these measurements of CO 2 and H 2 O."
875,1408.2792.training.tei.xml,11,"First, we propagate the measured CO 2 production rate from3.1 AU to 1.4 AU, then compute the water production rate using an assumed CO 2-to-H 2 O mixing ratio. The mean mixing ratio, based on Table 1 To estimate the gas fluence and peak volume density at the top of the Martian atmosphere, we modeled the coma with a modified three-generation Haser model (Festou 1981; Combi et al. 2004;Bodewits et al. 2011), considering H 2 O, CO 2 , CO, and CN. The relative abundances of CO and CN are based on the mean CO-to-H 2 O mixing ratio (0.07) from A' Hearn et al. (2012), and the ""typical"" composition of dynamically new comets from A' Hearn et al. (1995). We also include OH, H, and O as photodissociation products of H 2 O. Our results are given in Table 2."
876,1408.2792.training.tei.xml,12,"The raw simulations provide a guide to understanding what combination of grain size, ejection velocity, and age results in an impact hazard at Mars. We define impacts at Mars as any particle found within a distance of10,000 km from the center of the planet. This distance includes the orbit of Phobos (9400 km semi-major axis), and the apoapsis of the MAVEN spacecraft's nominal science orbit (6000 km; provided by NASA JPL). We also investigate a 5000 km region centered on the posi Table 1 Model parameters and results."
877,1408.2792.training.tei.xml,13,Set A Set B Set C Set D
878,1408.2792.training.tei.xml,14,"Gas production rate at3.1 AU, Qg (kg s −1 ) 25.7 tion of Deimos (23,000 km semi-major axis) at the time of closest approach. A third region of interest is based on the 48,000 km apoapsis of MAVEN 's orbit, assuming a 5-week delay in science operations. Given these criteria, the grain parameters that yield impacts are presented in Fig. 2. The only particles in simulation 1 that reach the Martian system are those ejected with speeds of a few meters per second, have radii of 0.7-3.6 mm, and are ejected at least 1.5 yr prior to the encounter."
879,1408.2792.training.tei.xml,15,"3.2. Impact Hazard For each parameter set, the impact hazards are computed by taking the set of particles found in each region of interest, removing those speeds outside the set's range, and weighting remaining particles according to the set's total production rate, grain size distribution, etc. Table 1 lists, for Mars, the raw number of impacting grains (i.e., before particle weighting), the impact fluence (i.e., after particle weighting), and the start and stop times of the hazard. No impacts are expected based on our nominal model, nor the v ej ∝ r −2 h model (sets A and D) because the ejection speeds of dust grains at r h >3 AU are too low to place particles within the vicinity of Mars (Fig. 2). In addition, displacing the comet dust in these two models according to the ephemeris 3-σ uncertainty ellipse does not result in any impacts."
880,1408.2792.training.tei.xml,16,"In order to attain impacting particle trajectories, higher ejection speeds are needed at r h >3 AU. This requirement is accomplished with the size-r h-speed relationship of parameter set B, resulting in a total fluence of 1 × 10 −7 grains m −2. Based on the comet's current predicted closest approach time, the grains arrive between 19:57 and 20:17 UTC (time at Mars), nearly centered on the epoch at which Mars crosses the comet's orbital plane (Farnocchia et al. 2014). Note that nongravitational forces frequently act upon comet nuclei, but we can neglect these effects because the dust is ejected at heliocentric distances where activity and resulting nongravitational forces were low (see Fig. 5 of Farnocchia et al. 2014). However, the current nucleus ephemeris uncertainty is still valid for the dust. Displacing the dust in parameter set B closer to Mars (set C) shifts the arrival time 5 min earlier and increases the fluence by a factor of 4."
881,1408.2792.training.tei.xml,17,"The fluence results are summarized for Mars and MAVEN in Fig. 3. The grains are limited to1 to 3 mm in radius, due to the combined effects of radiation pressure, grain age, and ejection speed. The timing of the hazard at MAVEN 's distant apoapsis is 25 min later than the hazard at Mars, and the fluences are a factor of 2 higher. In all simulations, the Deimos region of interest remained dust free. Gas outflow and nucleus gravity limits the size of dust grains that can be placed into heliocentric orbit. Meech & Svore˘ n (2004) present the critical dust radius, a crit , that can be lifted off a spherical nucleus by estimating the drag force on a spherical grain, and integrating the resulting equation of motion,"
882,1408.2792.training.tei.xml,18,"where µ is the atmoic weight of the driving gas, m H is the mass of hydrogen, Q is the gas production rate (molecules s −1 ), v th is the expansion speed of the gas, ρ g and ρ n are the grain and nucleus densities, R n is the nucleus radius, and G is the gravitation constant. Let v th = 0.6 (r h /3.8 AU) −0.5 km s −1 to be consistent with Farnham et al. (in preparation), and let the nucleus density be0.3 g cm −3. The radius of the nucleus has not been measured, but Bodewits et al. (2014) estimate R > 0.34 km based on water projection rates from Swift photometry. Therefore we consider two values: 0.5 and 2.0 km. For our adopted parameters, CO 2 can lift grains larger than 100 µm at heliocentric distances inside of 14 and 8 AU for R n = 0.5 and 2.0 km, respectively. However, our parameter set ejection speeds only place particles on impacting trajectories for r h > 11 AU (Fig. 2). Thus, given this simplistic model, an impact hazard may not be expected if the nucleus radius is ∼ 2 km or larger."
883,1408.2792.training.tei.xml,19,"Overall, we do not expect any impacts on Marsorbiting spacecraft. Based on the cross-sectional area of Mars and our10,000 km average fluence, the planet may receive up to ∼ 10 7 grain impacts from 1-to 3-mm-radius grains, totaling ∼ 100 kg, based on our models. At most, a few impacts may be expected on Phobos ( 100), and no impacts at Deimos. (in preparation) data, the same as our investigation, but with slightly different interpretations. They both predict little to no risk of impacts for the Mars-orbiting spacecraft, despite their independent approaches. In particular, Ye & Hui (2014) used observations of Siding Spring and the similarly bright comet C/2012 S1 (ISON) to derive the dependence of ejection speed on size and r h :"
884,1408.2792.training.tei.xml,20,"best matched their data, assuming a2.5-km-radius nucleus and 0.3-g cm −3 dust, resulting in no impacts for a > 0.1 mm, and a fluence of 2.6 × 10 −6 grains m −2 for grains down to 10 µm in radius. In our parameterization, these speeds correspond to v ref = 1.0 m s −1 , higher than our set B. Using their speeds and our production rate history, we find the same fluence, 2 × 10 −6 grains m −2 , but all impacts are millimeter sized. Finally, we compare our results to the natural background of meteoroids estimated for the Mars Reconnaissance Orbiter. Over a 5-year period, the total fluence for meteoroids with a > 1 mm is 0.0021 grains m −2 , and for a > 0.1 mm, it is 3.1 grains m −2 (Newell 2005 of magnitude smaller than these values, and we conclude the comet poses little additional hazard to the spacecraft."
885,1408.2792.training.tei.xml,21,"The neutral coma gases will enter the atmosphere with a relative velocity of56 km s −1. The kinetic energies of these molecules greatly exceeds their dissociation energies, e.g., for H 2 O, the kinetic energy is 293 eV, and the dissociation energy (H 2 O → OH + H) is 5 eV (Darwent 1970). The upper atmosphere of Mars consists of CO 2 , with few percent contributions from N 2 and Ar, and trace amounts of several other species (Krasnopolsky 2002). The comet gases will collide with the Mars gases, and quickly dissociate into atoms, erasing any molecular trace of the comet in the Martian atmosphere. The peak total particle and kinetic energy fluxes in Table 2"
