id,filename,pid,text
0,inserm-00851058.training.tei.xml,0,"The influences of sex and age upon endurance performance have previously been documented for both running and swimming.Age and sex influences upon performance have also been investigated for ultra-triathlons with distances corresponding to several Ironman distances and lasting several days, and for off-road triathlons combining swimming, mountain biking and trail running. Triathlon represents an intriguing alternative model for analyzing the effects of age and sex upon endurance and ultra-endurance (> 6 hours) performance because sex differences and age-related declines in performance can be analyzed in the same persons across the three separate disciplines. The relative participation of both females and masters athletes (age > 40 years old) in triathlon has increased consistently over the past 25 years. Sex differences in triathlon performance are also known to differ between the modes of locomotion adopted (swimming, cycling or running) for both elite and non-elite triathletes. Generally, time differences between sexes in swimming have been shown to be smaller on average than during cycling and running. Both physiological and morphological factors contribute to explaining these findings. Performance density (i.e. the time difference between the winner and 10 th placed competitor) has progressively improved (time differences have decreased) for international races over the past two decades for both males and females, with performance density now very similar for both sexes. For age-group triathletes, sex differences in total triathlon performance time increases with age. The possible difference in age-related changes in the physiological determinants of endurance and ultra-endurance performances between males and females needs further investigation however. Non"
1,inserm-00851058.training.tei.xml,1,"Triathlon is a unique endurance sport that combinesthree disciplines (swimming, cycling and running) over a variety of distances.  Triathlon first appeared at the end of 1970""s and in only one-quarter of a century has developed into a well-organized sport with global participation."
2,inserm-00851058.training.tei.xml,2,"The first Hawaii Ironman triathlon consisting of a3.8km swim, 180km cycle and 42km run had 12 male participants in 1978. Currently, more than 1700 triathletes , most of whom have to qualify at one of 25 Ironman triathlons worldwide, participate in this event which has become the Ironman World Championship.  Short or Olympic distance triathlons (1.5km swim, 40km cycle and 10km run) have also rapidly grown in popularity during approximately the same period with the first World Championship being held in Avignon (France) in 1989. Triathlon was officially accepted into the Olympic games as a full sport in Sydney in 2000.  Ultra-triathlons, consisting of distances greater than Ironman distance include double Ironman triathlons (7.6km swim, 360km cycle and 84 km run) and decaIronman triathlon (38km swim, 1800km cycle and 420 km run) also appeared during the 1980""s with the first double Ironman triathlon held in 1985 in Huntsville (USA).  More recently, in addition to conventional road based triathlon, off-road triathlon combining swimming, mountain biking and trail running has also established itself in the field of endurance sports, and has grown very rapidly in popularity.  Triathlon performance has been studied from numerous perspectives by a number of research groups over approximately the same period that the sport has grown. Research has investigated physiological  , biomechanical  , training  , nutritional  or medical  aspects of triathlon performance. Although Ironman triathlon is a relatively new ultra-endurance event, recently elite Ironman triathletes appear to have reached their performance limits  as has been observed in more traditional sports such as marathon running where performance times have plateaued.  With the increase in popularity of endurance sports worldwide, endurance sports have attract a greater participation of female and masters athletes (age >40 years) during recent times.  This review addresses the specific aspects of: i) sex differences and ii) age-related declines in triathlon performance. Sex differences in performance will be presented and discussed for each of the three disciplines and total event times for different distances and for both elite and age group triathletes. Age-related declines will be outlined by focusing on the performances of the best master triathletes because these athletes represent a unique model for studying the effects of high levels of physical training in persons of older age."
3,inserm-00851058.training.tei.xml,3,"Independent of age, the number of females competing in triathlon has increased progressively since the1980""s. For example, between 2000 and 2011, female USA Triathlon membership has grown from 27 % of the total number of annual members to more than 38 %.  Factors leading to this growth include society""s increasing acceptance of ""active"" females; females feeling more comfortable living an active lifestyle , and the growth of females-only events, good examples of which are the ""Danskin"" and ""Trek Triathlon"" Series in USA."
4,inserm-00851058.training.tei.xml,4,"The rates of female participation appear to decrease with an increase in distance of triathlon races. For example, in2010 females accounted for 26%, 19% and 13% of athletes competing at short, half-Ironman and full-Ironman distance triathlons held in the region of Zurich (Switzerland)  . However, for ultra-triathlons, female participation remains relatively low, representing generally less than 10% of overall participant numbers.  The number of females finishing the Hawaii Ironman World Championship increased from 20 in 1981 (6% of participants) to more than 470 in 2010 (27 % of participants).  In Europe, there was also a progressive rise in the number of female Ironman finishers but overall rates were lower. In 2011, females accounted for 13% of the field at Ironman Switzerland.  Lower rates of female participation in Europe may because European Ironman triathlon is relatively younger compared to the Hawaii Ironman triathlon. Indeed, the first Hawaii Ironman was held in 1978, while one the first European Ironman, Ironman Switzerland, was held in 1995. Female participation in Ironman triathlon remains slightly lower compared to traditional endurance events such as marathon running, but greater than ultra-endurance events such as a 161-km ultramarathon. For example, Lepers & Cattagni  showed that the relative participation of females at the New-York City Marathon increased over the last 30 years from 17% to 33% of the total field. In contrast, females accounted for 20 % of the finishers in the same time period at 161-km ultramarathons in North America. "
5,inserm-00851058.training.tei.xml,5,"Physiological and morphological characteristics may account for the sex differences seen in triathlon performance.Even though there is a lesser amount of data for females compared to males, studies have shown that maximal oxygen uptake ( V  O 2max ), lactate threshold and running economy interact similarly in females as determinants of endurance performance as they do in males.  Current explanations for sex differences in V  O 2max among elite athletes, when expressed relative to body mass, provide two major findings.  First, elite females have more  body fat than males.  Indeed, much of the difference in V  O 2max between males and females disappears when it is expressed relative to lean body mass.  Second, the hemoglobin concentration of elite athletes is 5-10% lower in females than in males.  Concerning lactate threshold, there is no reason to believe that values should be lower in females than in males because mitochondrial adaptations in the skeletal muscles of highly-trained male and female athletes appear to be similar.  Finally, the average oxygen cost to run a given speed, (i.e. running economy) by groups of elite male and female athletes is similar and appears to play the same role in determining success in endurance performance. Therefore, the major physiological reason that explains the slower record performances by females compared to males is probably the lower V  O 2max values observed in females."
6,inserm-00851058.training.tei.xml,6,"Physiological differences between male and female triathletes have been infrequently investigated. The differences in the physiological responses in cycling and the energy cost of running after cycling have been compared in males and females for both elite junior and senior triathletes. These authors showed that senior females had a significantly higher cycling peak power output than their junior counterparts. Additionally, senior males had a higher ventilatory threshold than junior males whereas the ventilatory threshold was similar in junior and senior females."
7,inserm-00851058.training.tei.xml,7,"A recent study conducted on junior triathletes has suggested that morphological characteristics of triathletes have evolved since late1990""s.  In 2011, both male and female junior elite triathletes appeared more ectomorphic than their 1997 counterparts."
8,inserm-00851058.training.tei.xml,8,"Nowadays, junior triathletes are proportionally lighter, with significantly smaller flexed arm and thigh girths, and femur breadths. The junior males in2011 also had significantly longer segmental lengths and lower endomorphic values than their 1997 counterparts."
9,inserm-00851058.training.tei.xml,9,"More research is required however, to validate these findings for senior triathletes."
10,inserm-00851058.training.tei.xml,10,"Male triathletes possess a larger muscle mass, greater muscular strength and lower relative body fat compared to female triathletes. Low body fat is an important predictor variable for total time performance in triathlon. For example, Knechtle et al.  showed that low body fat was associated with faster race times in male Ironman triathletes but not in females. Males possess on average 7-9% less percent body fat than females, which is likely an advantage for males. Therefore, it appears that sex differences in percentage body fat, oxygen carrying capacity and muscle mass may be major factors for sex differences in overall triathlon performance. Menstrual cycle, and possibly pregnancy, may also impact training and racing in female athletes, factors that do not affect males. "
11,inserm-00851058.training.tei.xml,11,"Sex differences in endurance and ultra-endurance (>6h)  performance have received considerable attention over the past few decades, but the majority of studies have focused on running performances.  Interestingly, Speechly et al.  reported that females, who were matched with males for a 42-km run, were faster than males in a 90-km race. Similarly, it has been shown that females and males who were matched for 50-km trail running performance also performed similarly in trail runs of 80-and 161-km distances.  Despite the suggestion in 1992 that females may one day outrun males in competitive ultra-endurance events  , elite males appear to run approximately 10-12% faster than elite females across all endurance running race distances up to marathon, with the sex difference narrowing as the race distance increases.  However, at distances greater than 100km, such as the 161-km ultramarathon, the difference seems even larger, with females 20-30% slower than males. Insert TABLE 1"
12,inserm-00851058.training.tei.xml,12,"Sex differences in triathlon performance have previously been described for elite triathletes and for non-elite triathletes of different age groups  for long distances (distances greater or equal to half-Ironman)  and for off-road triathlon  . Surprisingly, very little data is available for short distance triathlons especially for high-level international races. One reason may be that the top international short distance triathlons, (i.e. World Championship Series events or Olympics) have all been draft legal for several years and therefore it is difficult to find a reference of high level Olympic distance triathlon without drafting for comparison. The increase in nondrafting international distance triathlons such the Hy-Vee triathlon that offers significant prize money for both male and female winners and represents a highly competitive platform for professional triathletes should help to better determine sex differences in short distance triathlon performance when athletes compete on a level (non-drafting) playing field in the future. Table 2 presents the most recent data for sex differences in triathlon performance for international elite triathletes participating in the most competitive races at each triathlon distance. By 2012, values narrowed so much that, for the top 10 triathletes overall in three top level international road-based triathlon races, the difference between males and females was 11.3% for the Hawaii Ironman triathlon, 14.1% for the Olympics and 9.3% for the Hy-Vee short distance triathlon (see Table 2). Non road-based triathlon produced a greater sex difference (discussed in more detail below). Interestingly, for ultra-triathlons, it has been shown that with increasing length of the event, the best females became relatively slower compared to the best males.  Indeed, if the world""s best performances are considered, males were 19% faster than the females in both Double and"
13,inserm-00851058.training.tei.xml,13,"Triple Ironman distance, and30% faster in the Deca-Ironman distance.  However, nonphysiological factors may have contributed to these observations, in particular a fewer overall number of female finishers in ultra-triathlons, compared to formats of more standard length. 2.4 Sex differences in triathlon swimming performance"
14,inserm-00851058.training.tei.xml,14,"The average sex difference in swimming performance during triathlon for race distances between1.5 and 3.8 km ranged between approximately 10% and 15% for elite triathletes (see Table 1). The sex difference in triathlon swimming performance is consistent with values found for different pool swimming events. It has been shown that sex differences in pool swimming performances become progressively smaller with increasing distance from.  This seems also to be the case for triathlon as Table 1 shows that, the longer the distance of the swim component of a triathlon race, the smaller the sex difference, particularly when the top 10 age group athlete performances are considered. In ultra-endurance outdoor swimming events, female swimmers have tended to reduce the gap with their male counterparts. For example, time differences between male and female swimming records are 6.7% for the 32-km ""English Channel Swim"" and 2.3% for the 26-km ""Marathon Swim in Lake of"
15,inserm-00851058.training.tei.xml,15,"Zurich"" in Switzerland, respectively. However, the sex difference in performance between the best male and female ultra-swimmers is more generally close to 11-12%, which corresponds to values observed for swimming in triathlon.  It has been shown that the elite male and female triathletes completed the 3.8-km swim stage of the Hawaii Ironman triathlon ~ 10% slower than the elite swimmer specialists for the same distance at the Waikiki Roughwater Swim race.  This difference could be explained by better propelling efficiency in elite swimmers compared with elite triathletes.  Analysis from 2005 showed that the sex difference in triathlon swimming appears lower than in cycling and running at the Hawaii Ironman triathlon and at the off-road triathlon Xterra World Championship.  The difference between swimming and the two other disciplines could be explained in part by the biological difference in relative body fat (7-9 % higher in females).  Performance in activities that involve supporting ones weight, for example running, may be more susceptible to a greater body fat percentage compared to water-based events such as swimming, during which body fat can increase buoyancy and therefore improve performance.  Buoyancy is also improved in females through a lower ""underwater torque"", which can be defined loosely as the tendency for the feet to sink.  In addition, in contrast to running where the energy cost appears to be similar between females and males, the energy cost of freestyle swimming has been shown to be significantly higher (i.e. lower economy) in males compared to females.  At a velocity of 1 m/s, there are differences in drag force and coefficient of drag between males and females.  The energy cost of swimming depends essentially on the propelling efficiency of the arm stroke and hydrodynamic resistance, but it has been suggested that differences in energy costs of swimming between sexes are mainly to be attributed to differences in hydrodynamic resistance.  In contrast, differences in energy cost of swimming across ages may be attributed also to changes in the propelling efficiency of the arm stroke.  Females have smaller body size (resulting in smaller body drag), smaller body density (greater fat percent) and shorter lower limbs, resulting in a more horizontal and streamlined position and therefore a smaller underwater torque. "
16,inserm-00851058.training.tei.xml,16,"Sex differences in triathlon cycling vary from12 to 16% according to the level of expertise of participating triathletes for road-based triathlons (Table 1). Data gained from analysing male and female participants"" performances in the 180-km cycling leg of an"
17,inserm-00851058.training.tei.xml,17,"Ironman triathlon are unique datasets as official time-trial road-cycling championships generally take place on distances much shorter than180-km. Moreover, there is a paucity of data concerning sex differences in road or track cycling performance.  In track cycling, where females are generally weaker than males in terms of power/weight ratios, the performance gap between males and females appears to be constant and independent of the race distance from 200 to 1000 m.  In ultra-cycling events, such as the ""Race Across America"", sex difference in performance was around 15% among top competitors.  Greater muscle mass and aerobic capacity in males, even expressed relative to the lean body mass  , may represent an advantage during long distance cycling, especially on a relative flat course such as Ironman cycling where cycling approximates to a non-weight-bearing sport. Indeed, it has been shown that absolute power output (which is greater for males than for females) is associated with successful cycling endurance performance because the primary force inhibiting forward motion on a flat course is air resistance.  Interestingly, for elite triathletes the sex difference in mountain bike cycling during off-road triathlon  is greater compared to cycling sex differences in conventional roadbased events.  Mountain biking differs in many ways from road cycling. Factors other than aerobic power and capacity such as off-road cycling economy, anaerobic power and capacity, and technical ability might influence off-road cycling performance.  Bouts of high intensity exercise frequently encountered during the mountain biking leg of off-road triathlon  can result from: 1) having to overcome the constraints of gravity associated with steep climbs, 2) variable terrain necessitating wider tires and thus greater rolling resistance, and 3) isometric muscle contractions associated with the needs of more skilled bike handling skills, not so often encountered in road cycling. In particular however, lower power-to-weight ratios for females compared to male triathletes inevitably leave them at a disadvantage during steep climbs.  Moreover, the increased bike handling skills, required especially during downhill mountain biking may be impaired by relatively lower female arm or leg isometric muscle strength, meaning that greater sex differences in off-road triathlon could be attributed to decreased ability to control the bicycle in females. However, this assumption needs to be confirmed with specific investigations of the effect of sex on technical ability in mountain biking.  As percentage differences in time do not equate to percent differences in power output, due to non-linear relationships between speed and power output from air or water resistance  , the magnitude of the sex difference has also been examined by calculating the percentage difference between males and females in estimated power outputs for each discipline.  In this case, differences in estimated power output between the sexes are greater for triathlon cycling than for the swimming and running disciplines. For example, sex differences in power output in swimming, cycling and running were estimated to be 28%, 39% and 33%, respectively for Ironman triathlon, and 30%, 45% and 33% for off-road triathlon.  Because power output is proportional to oxygen uptake, the magnitude of sex differences in power output provides a more realistic representation of underlying sex differences in physiological capacity. 2.6 Sex differences in triathlon running performance"
18,inserm-00851058.training.tei.xml,18,"During the1988-2007 period, the top 10 elite males have run the Hawaii Ironman marathon on average 13.3% faster than the top 10 females.  In contrast, during the same period, elite female triathletes have improved their marathon running times by 0.8 min/yr while times have remained stable for the males. While these improvements in female performances compared to males are impressive, they remain as yet unexplained, which is strange when it is considered that females have benefited from similar training and nutritional advances. If females continue to improve their running performance at Ironman, they could reduce the sex difference in the marathon leg and therefore their overall performance times."
19,inserm-00851058.training.tei.xml,19,"For example, at the2012 Hawaii Ironman, the difference in marathon times between the top 10 elite males and the top 10 elite females reduced to 7.3 % . Another notable example is that the female winner of the famous Roth"
20,inserm-00851058.training.tei.xml,20,"Ironman (Germany) in2011 ran only 2.6% slower than the winning male . At the same race, both female and male winners bettered the Ironman distance performance world record .  Thus, it appears that the marathon running leg of Ironman triathlon has become the discipline in which female elite triathletes have most reduced the gap with their male counterparts. Interestingly, Lepers  showed that for the top 10 elite finishers the sex difference in running at the Hawaii Ironman marathon was similar to that recorded during the New-York marathon, suggesting above all, that the swim and cycle legs of the triathlon do not exacerbate the sex difference in running a marathon. Thus, the physiological differences between males and females in running performance that have been identified to occur in a regular marathon still persist in the marathon of an Ironman."
21,inserm-00851058.training.tei.xml,21,"Contrary to the knowledge of running performance differences between sexes for the marathon distance, few analyses have been conducted between males and females who have run10-km during an Olympic distance triathlon. A mean sex difference of 17% was found for the Zurich Switzerland Olympic distance triathlon during the 2000-2010 period.  However, as Table 2 shows, when data from 2012 only is considered, there is a considerable difference even within elite level Olympic distance run performances, between males and females. A difference of 12.3% existed during the draft-legal Olympic short distance race in London, whereas the difference was lower (8.6%) at the Hy-Vee international triathlon in Des Moines (draft-free). It would appear that the format of the triathlon (drafting or not) affects males differently to females, with the possibility that males benefit in terms of their subsequent running performance off the bike, to a greater extent when riding in a peloton. However, running performances in males and females need to be more closely analyzed in relation to the effort produced during the cycle leg of an Olympic distance triathlon."
