id,filename,pid,text
531,1001.4731.training.tei.xml,18,"Some consideration was given to placing the WMAP observations in a wider context, with the goal of gaining further insight into the model parameters. A search was made for a dataset that would provide absolutely calibrated, whole-disk observations of Mars which spanned both sides of the thermal energy distribution peak and were taken over a reasonably contiguous interval of time. Mars data taken by the COBE/DIRBE instrument (Boggess et al. 1992; Hauser et al. 1998) for a146day interval (1990 April 28 -September 20) most closely matched these requirements, although no analysis of the publicly available data appears to have been previously published. There are six DIRBE wavebands which sample the thermal emission portion of the Mars spectrum, with effective wavelengths of 12, 25, , 60100, 140 and 240 µm. Of these, the 25 µm observations cannot be used as an independent check of the Wright model, since the model itself was the ultimate source of the DIRBE absolute calibration in this band (S. Moseley & W. Glaccum 2009, private commu- nication, Hauser et al. 1998). In addition, while the 12, 25, 140 and 240µm detectors are well-behaved linear devices, the 60 and 100µm detectors are known to suffer non-linear response , and Mars is on the bright end of that response. DIRBE is a broad-band photometer, and reports monochromatic flux values at the effective wavelength of each band assuming a constant source spectrum in νI ν across the band. One must apply a "" color correction factor "" to the reported fluxes if the source spectrum is different from that assumed. The DIRBE Explanatory Supplement provides such factors for gray-body and power-law spectra. However , in the case of Mars, some of the DIRBE bands intercept known atmospheric absorption lines. A significant CO 2 absorption centered at 15µm lies well within the 12µm passband, and grazes the blue edge of the 25µm band. Numerous minor water vapor absorptions are known to occur at wavelengths sampled by the 60 and 100µm bands (Sidher et al. 2000). We have used spectral data available from the MGS Thermal Emission Spectrograph (TES) public archives and the ISO spectrum published by Sidher et al. (2000) to form approximate correction factors for the DIRBE data at these bands: only the 12µm band required significant correction. For the 140 and 240 µm bands, color corrections were calculated using the spectrum predicted by the Wright model."
532,1001.4731.training.tei.xml,19,"A mean flux at each DIRBE effective wavelength was evaluated over the146day interval, including application of color corrections and scaling to a fiducial solid angle at a distance of 1.5 AU (Table 7). Although the epochs of WMAP and DIRBE observations are separated by more than 10years, the viewing geometry at the time of the DIRBE observations is most closely duplicated during WMAP observing season four. The WMAP mean brightness temperatures for this season were also converted to fluxes using the same fiducial solid angle,"
533,1001.4731.training.tei.xml,20,"and both sets of data plotted as a spectrum in Figure 5. The spectra predicted by the Wright model for the mean time of thetwo epochs are also shown on the plot. For clarity, the quoted model errors of about ±5% are not shown on the plot. On the logarithmic scale needed to show both sets of data together, the  two model spectra overlay each other. Within the quoted data and model errors, the DIRBE measurements at 60 and 100µm do not match well with the model. The DIRBE 12 µm data deviate by a little more than 1σ, accounting for both data errors and model accuracy. In the case of the 60 and 100µm bands, we suspect a non-linear response to a bright object is the root cause. The 12 µm band has a low absolute calibration error, but there is a significant and uncertain color correction due to the CO 2 atmospheric absorption. Ratios of the DIRBE fluxes to Wright model predictions are presented inTable 7; the major source of DIRBE error is that of the absolute calibration, which is also listed. DIRBE observations at 140 and 240 µm agree within the 10% calibration errors, but cannot be used to deduce any trend with frequency, such as seen by WMAP. We decided to forgo adjustments to the model at this point."
534,1001.4731.training.tei.xml,21,"As currently implemented, the Wright model may be used to predict microwave observations at WMAP frequencies by applying a "" post-processing "" multiplicative scaling factor to the published values: T new = T pub × f scl . For both model and data evaluated at3.2mm, we have already noted a scaling factor of 0.953. We use the mean ratios of the remaining  four frequencies to W band (Figure 4) as scaling factors for these frequencies, which are in Column 2 ofTable 8 . The W-band observations can be reproduced to ∼ 0.5%, with confidence decreasing with frequency to ∼ 2% at K band. Since the 3.2mm model values we have computed are not published, we also provide scaling factors to the 350µm temperatures, which are derived from the the scaling factor of 0.941 noted earlier and multiplied through by the 3.2mm scaling ratios."
535,1001.4731.training.tei.xml,22,"Differences between measurements and the Wright model at WMAP wavelengths are not unexpected. The Wright model was designed to predict infrared emission arising from the top layer of the Martian surface, whereas the microwave signal originates from subsurface layers of orderseveral centimeters deep (de Pater 1990; Orton & Burgdorf 2003 ), with potentially different composition and compaction. This was recognized by Griffin et al. (1986 slightly revised version of the model maintained at NRAO 4 . In general, Rudy model predictions using the "" standard dielectric constant "" were slightly high compared to the WMAP observations, by ∼ 1% at 3.2 and 4.9mm and roughly 3% at 7.3, 9.1 and 13.1mm. It should be noted that the WMAP observations provide model constraints only in the disk-averaged sense. The post-processing scaling of the Wright model suggested here simulates a frequency-dependent emissivity, which implies slow changes in mean subsurface properties with depth. In the Rudy model, which already incorporates subsurface sampling, use of model parameters derived from the radio data produces agreement with WMAP within a few percent. It is possible that this agreement could be improved either through the use of a revised dielectric function or updated thermal inertia and albedo maps. The thermophysical parameters used by the Rudy model are based on ∼20 year old maps of thermal inertia and albedo from the Infrared Thermal Mapper (IRTM) aboard Viking (Muhleman & Berge 1991). More recent MGS maps of these quantities obtained using the TES instrument are available with roughly 10 to 40 times better spatial resolution, full planet coverage and approximately twice the signal-to-noise (Christensen 1998; Christensen et al. 2001). The surface albedo has been observed to have some time dependence: a visual comparison between the Viking IRTM and TES albedo maps shows alterations in the spatial pattern have occurred since the Viking mapping (Christensen et al. 2001)."
536,1001.4731.training.tei.xml,23,"As with Mars, Saturn's microwave brightness temperature varies considerably over time for near-Earth observers, primarily as a result of geometrical effects. Here the dominant factors are the observer's changing viewing angle of the rings and projected disk of the oblate planetary spheroid."
537,1001.4731.training.tei.xml,24,"The ring system presents the main difficulty in Saturn's use as a calibrator in the microwave, although substantial progress has been made in understanding and modeling it. As evidenced by images from Hubble Space Telescope (HST) and data from orbiter and flyby missions such as Cassini and Voyager, Saturn's ring system is complex and rich in detail. The brightest rings (A, B, C) are composed of objects typically less than5m in size (Marouf et al. 1983) and are composed primarily of water ices mixed with a small amount of impurities (Poulet et al. 2003, and references therein). Those portions of the rings between the observer's line-of-sight and the planet serve to attenuate emission from Saturn's disk. The rings also contribute to the microwave signal via a mix of scattering and"
538,1001.4731.training.tei.xml,25,"thermal re-emission of planetary radiation. The crossover point between thetwo emission mechanisms occurs near 1cm (Dunn et al. 2002; Schloerb et al. 1980; Epstein et al. 1980), with thermal emission dominating shortwards and scattering longwards. Optical depths have been measured at a variety of wavelengths: Dowling et al. (1987) found that the optical depth of the combined ABC rings is roughly gray over a wide frequency range. Voyager I radio occultation observations (Tyler et al. 1983) at 3.6 and 13cm produced radial profiles of optical depth for the A and C rings and Cassini division, but only approximate results for portions of the B ring with τ > 1. The most complex and recent modeling of microwave data is that of Dunn et al. (2002 Dunn et al. ( , 2005 Dunn et al. ( , 2007) who use a Monte Carlo radiative transfer code to simulate the scattered and thermal emission of the rings based on VLA and other high-resolution observations. WMAP does not spatially resolve the individual components of the Saturn system, nor is the spectral coverage sufficient to definitively isolate ring scattering and thermal spectral regimes. However, the changes in viewing geometry with orbital phase can be used to break degeneracy between ring and disk components, especially as the viewing aspect of the rings becomes more "" edge-on "" . Over the currently available seven-year observing baseline, Saturn's rings are seen at inclinations between  −28° and  −6 ° : the sign convention indicates that the planet's south pole is tilting slowly away from the observer as the 0 ° edge-on equatorial configuration is approached.Figure 6 illustrates the  two extrema andTable 9 lists mean times and ring opening angles for each observing season. Hill et al. (2009) briefly discussed WMAP five-year W-band observations of Saturn, which sampled ring opening angles B ≤ −17 ° . They found that the brightness temperature could be fit remarkably well with a simple sin B dependence. This convenient relationship does not effectively characterize the behavior at lower inclinations, however, and so a more complex formulation is needed for the seven-year data. We adopt a simple empirical model of Saturn's microwave emission, variants of which have appeared in the literature for over 30years (e.g., Epstein et al. 1980). The goal is to provide a predictive formula for the unresolved observed brightness of Saturn with as low an error as possible: however, given the WMAP data constraints, such a model will lack physical detail. At a given frequency ν, we assume a single temperature for the planetary disk, T disk (ν), and that all rings are characterized by the same temperature T ring (ν). The model variant we adopt allows for seven radially concentric ring divisions as defined by Dunn et al. (2002), which are based on optical depth variations observed by Voyager (Tyler et al. 1983). Each of the seven ring sectors has its own ring-normal optical depth τ 0,i , with 1 ≤ i ≤ 7, but each τ 0,i is assumed to be both constant within its ring and frequency independent."
539,1001.4731.training.tei.xml,26,"Those portions of the planetary disk which are obscured by ring cusps will have their emission attenuated by a factor e −τ 0,i | csc B| , where B is the ring opening angle seen by the observer. Thus at a given frequency and ring opening angle B:"
540,1001.4731.training.tei.xml,27,"where A ud , A od,i and A r,i are the projected areas of the unobscured disk, the portion of the disk obscured by ring i, and i th ring, respectively. These areas are normalized to the total (obscured+unobscured) disk area. T ring (ν) is an observed brightness temperature and hides such physical details as ring emissivity and the apportionment of the scattering versus thermal emission. The assumption of a single mean ring temperature is a convenience rather than reality (Spilker et al. 2006; Grossman et al. 1989; Dunn et al. 2002). However, the apportionment between individual rings is not critical to the model fit, as it only depends on the summed total ring emission. Potential contributions to modeling error from nonuniform planetary disk emission are discussed later in this section."
541,1001.4731.training.tei.xml,28,"The WMAP brightness temperatures inTable 9 are sorted by frequency band and B and then a single simultaneous fit for the model parameters is made.Two separate fits were tried, differentiated from one another in the handling of the ring optical depth. In one fit, the τ 0,i were held fixed at the values chosen by Dunn et al. (2002) (Table 10), and the ten disk and ring temperatures (for each of 10 DAs) were solved for. In an alternate fit, the relative ratios between the τ 0,i were fixed as per the table, but a single τ 0,max was solved for in addition to the ten free temperatures. Both fits returned similar results, with reduced χ 2 of ∼ 1.2 for ∼ 100 degrees of freedom. We show only the results for the fixed-τ fit."
542,1001.4731.training.tei.xml,29,"The disk and ring brightness temperatures derived from this model fit are presented inTable 11. Formal errors for the ring and disk temperatures at lower frequencies are higher because the ring contribution is smaller and there is a larger covariance between thetwo components. The model fit and residuals are shown inFigure 7. The model reproduces the observations to within ∼ 3%, but observations closer to B = 0 ° would better constrain the disk temperatures and so reduce the covariance between the disk and rings. The parameterization chosen for the ring optical depths, together with the incomplete sampling of the ring system orientation, allows for alternate models which would fit the data equally well but return somewhat different mean disk and ring temperatures. This systematic is not reflected in the formal fitting errors inTable 11. In order to assess the magnitude of this error, we explored a small number of model variants. The model which fit the data equally well but returned temperatures with the largest differences compared toTable 11 consisted of a combined ABC ring represented by a single τ 0 , which was a free parameter in the fit. Disk temperatures derived for this model were ∼ 2.5K higher, and ring temperatures ∼ 1  K  lower. As a conservative approach, we additively combine this estimated systematic error with the formal fitting errors to produce the "" adopted error "" columns inTable 11. The derived disk and ring temperatures match well with those already in the literature.Figure 8 shows the WMAP derived disk temperatures in context with the compendium of plus more recent interferometric observations. The ring temperatures also compare well with those measured directly from high-resolution images of the ring ansae (Dunn et al. 2005; Schloerb et al. 1980;): seeFigure 9.Figure 10 illustrates the percentage contribution of the ring to our total model, which sums the ring emission and attenuation of disk radiation, as a function of frequency and ring inclination B."
543,1001.4731.training.tei.xml,30,"The empirical model described here assumes Saturn's mean whole-disk temperature is time invariant at each frequency. The presence of band-like structures (which can persist foryears) and latitudinal brightness gradients at the ∼ 5% level have been noted by several observers at wavelengths of 2cm and longward (Grossman et al. 1989; de Pater & Dickel 1991; van der Tak et al. 1999 ). There is less discussion in the literature of disk temperature structure and/or variability at the frequencies observed by WMAP: there have been no reports of bands or localized structures, but some indication of north/south latitudinal brightness differences. Within the seven-year epoch under consideration, Dunn et al. (2005) observed a latitudinal disk brightness gradient at 3mm, such that the north pole was brighter than the south by ∼ 5%. They interpreted differences between their 1.3mm and 3mm data, taken roughly 4months apart, as possible evidence for atmospheric changes on week to month timescales. In order to estimate potential model bias caused by the assumption of a uniform disk temperature, Saturn seasonal brightness temperatures were simulated using geometrical models similar to those described in this section, with the addition of a disk latitudinal gradient as described by Dunn et al. (2005) . If one makes the assumption that such a temperature gradient is persistent over seven years and exists at all WMAP frequencies, then such structure would produce a temperature behavior with inclination which is asymmetric about B = 0 ° . This is because the rings would obscure hotter regions in the northern portion of the disk but colder regions in the south, producing a maximum deviation from symmetry of ∼ 1% at the largest ring opening angles. Since the WMAP seven-year observations sample slightly less than half of the full B range, this asymmetry would not be evident, and a model fit which assumes a constant disk temperature would use the ring model component to compensate for the disk temperature gradient. For a simulated dataset matching the WMAP seven-year observing seasons, the model fit returns a mean ring temperature biased by less than 1 K, with an unbiased recovery of the mean whole-disk temperature. This estimate is of uncertain quality, however, because it is based on a snapshot of Saturn at  one wavelength and a narrow time window. For this reason, the adopted errors inTable 11  An extended, low optical depth dust ring associated with Saturn's moon Phoebe was recently discovered using Spitzer imaging at 24 and 70µm (Verbiscer et al. 2009). With a quoted radial extent between at least 128 and 207 Saturn radii, or roughly 1 ° in apparent diameter, it would be possible for WMAP to resolve the Phoebe ring, with W band as the best chance for doing so. However, no signal from the ring was detected by WMAP. Properties of the grains are not well specified, but naive estimates assuming typical dust emission and optical depth frequency dependencies would predict temperatures at 94 GHz of less than 1 µK, well below achievable noise levels of about 300 µK (1σ)."
544,1001.4731.training.tei.xml,31,"With their lower brightness, lack of a dominant ring system, and small solid angle, Uranus and Neptune are used as primary calibrators in infrared through radio wavebands for both ground-and space-based instruments. Spectral coverage in the microwave is somewhat undersampled, however, leaving room for interpretation in atmospheric modeling efforts . The microwave spectra of Uranus and Neptune lack the broad NH 3 absorption centered near24 GHz which is characteristic of Jupiter and Saturn. At millimeter wavelengths, collision-induced absorption by H 2 is considered the dominant continuum opacity source. CO rotational absorptions have been observed for Neptune in the sub-millimeter (Marten et al. 2005 ). At centimeter wavelengths, ammonia (which is depleted relative to solar nitrogen levels ) and hydrogen sulfide are the main opacity contributors (Deboer & Steffes 1996; Spilker 1995;). Of special note is Uranus' unique 98 ° obliquity, which allows for a slowly changing pole-to-pole panorama of the planet as it moves in its 84year orbit, and may also play a role in determining atmospheric conditions. For selected frequencies, observational databases spanning decades have permitted characterization of the variability of these two planets. Uranus in particular has exhibited long-term whole-disk temperature changes since 1966 which correlate with the viewing aspect of the south pole. After accounting for geometrical solid angle changes, Kramer et al. (2008) reported a gradual temperature drop of order 10% over 20years (1985-2005) at 90 GHz. This is interpreted as a true integrated-disk temperature change, as the 1985 face-on contribution from the bright south pole progressively morphs into a 2007 view dominated by colder equatorial regions. Similar findings, with similar phasing albeit different amplitudes, have been reported in the radio (Klein & Hofstadter 2006) and visible (Hammel & Lockwood 2007). There is weaker evidence that some portion of variability in the light curves is attributable to changes deep in the atmosphere (Klein & Hofstadter 2006); Hofstadter & Butler (2003) used VLA 2 and 6cm "" snapshots "" of the disk over several  years to argue for opacity changes in zonal bands. Neptune's microwave variability is less well documented, although there is ample evidence for variability in the visible and near- IR, as summarized by Hammel & Lockwood (2007). Kramer et al. (2008 find the 90 GHz integrated disk temperature to be constant to within ∼ 8% over 20years. Peak WMAP antenna temperatures for these distant "" ice giants "" range from roughly 1 mK at W band to ∼0.2mK at K band. The signal-to-noise for individual observations of these objects is low (∼0.3 at W band, ∼0.14 at K band), resulting in large statistical errors in single-season disk temperature determinations. Tables 12 and 13 present the single-season brightness temperatures computed for Uranus and Neptune. Brightness temperatures are listed per frequency rather than per DA as a means of boosting signal-to-noise for those frequencies with multiple DAs. Temperatures for Uranus observing seasons four and five exhibit somewhat larger error bars than other seasons. For these two seasons, there was a reduction in the number of observations available for analysis because data quality checks excluded observations in close proximity to Mars sky coordinates. Sub-WMAP latitudes for Uranus range between −30 ° and 4 ° over our seven-year baseline . Linear correlations of T b against both sub-WMAP latitude and time produced no statistically significant trend other than a flat line. This is not surprising given that the tightest seasonal temperature errors are of order 10%, which encompasses the entire twentyyear range of variation seen in the 90 GHz light curves of Kramer et al. (2008). We performed similar correlations for Neptune, with again the same null variability result. Note, however, that the sub-WMAP latitude for this planet is relatively unchanged over the epochs of observation . With no discernable variability over the observing baseline, we computed seven-year means of the disk brightness for each planet; these are listed as the last line in Tables 12 and 13 . These seven-year means in turn may be compared to observations in the literature and placed in context with the microwave spectra in general.  only returned those few acquired in the late 1960s, listed inTable 1 of Gulkis et al. (1978). For a variety of reasons, more recent observations would be preferable, but the older epoch does have the advantage of sharing a similar viewing geometry to that of the WMAP data. These older observations are plotted in gray in the Figure, and agree well with the WMAP measurements, but also do not define a "" dip "" at high statistical significance. Although suggestive of an interesting atmospheric opacity constraint for future study, the possibility of such a feature has gone unremarked in the literature."
545,1001.4731.training.tei.xml,32,"Non-variable, spatially isolated fixed celestial calibrators formillimeter wavelengths are not common. At high Galactic latitude, bright sources are predominantly identified as some form of AGN/QSO, which are prone to outbursts and variability on a wide range of timescales and frequencies. Brighter sources in the Galactic plane tend to be HII regions (which may not be "" point-like "" ) or supernova remnants (SNRs) with potential variability. At moderate spatial resolution, confusion with neighboring diffuse and compact sources in the Galactic plane can be an issue for background subtraction. Five sources were chosen for study out of an original list which included some of the brightest sources from Baars et al. (1977) and Ott et al. (1994), in addition to the brightest, least variable objects from the seven-year WMAP source catalog (Gold et al. 2010). The five selected sources are listed inTable 14. Some of the sources which were initially considered  but ultimately rejected, primarily because of low background contrast, included 3C286, NGC 7027, 3C84, 3C218, 3C123, and 3C147. There are unfortunately few suitable calibration sources in the Southern hemisphere with a long-term history of observation."
